{
  "schema_version": "o2.candidate.v1",
  "maturity": "researched",
  "contract_frozen": false,
  "synthetic": true,
  "identities": [
    {
      "identity_id": "idn-eq-v1",
      "market_family": "equity",
      "identity_version": 1,
      "venue": "us_equity",
      "currency": "USD",
      "prior_identity_id": null,
      "equity": {
        "issuer_cik": "0000000001",
        "listing_key": "us-equity:cik:0000000001:class:common",
        "ticker": "SYNTH",
        "share_class": "common"
      }
    },
    {
      "identity_id": "idn-eq-v2",
      "market_family": "equity",
      "identity_version": 2,
      "venue": "us_equity",
      "currency": "USD",
      "prior_identity_id": "idn-eq-v1",
      "equity": {
        "issuer_cik": "0000000001",
        "listing_key": "us-equity:cik:0000000001:class:common",
        "ticker": "SYNTH",
        "share_class": "common"
      }
    },
    {
      "identity_id": "idn-ev-b1",
      "market_family": "event",
      "identity_version": 1,
      "venue": "kalshi_demo",
      "currency": "USD",
      "prior_identity_id": null,
      "event": {
        "environment": "demo",
        "api_path_observed_not_selected": "trade-api/v2",
        "series_ticker": "KXSYNTH",
        "event_ticker": "KXSYNTH-26JAN01",
        "market_ticker": "KXSYNTH-26JAN01-B1",
        "contract_family": "binary",
        "collateral_return_type": "",
        "settlement_sources": [
          {
            "name": "Synthetic determination source",
            "url": "https://example.invalid/kxsynth-determination"
          }
        ]
      }
    },
    {
      "identity_id": "idn-ev-void",
      "market_family": "event",
      "identity_version": 1,
      "venue": "kalshi_demo",
      "currency": "USD",
      "prior_identity_id": null,
      "event": {
        "environment": "demo",
        "api_path_observed_not_selected": "trade-api/v2",
        "series_ticker": "KXSYNTH",
        "event_ticker": "KXSYNTH-26JAN01",
        "market_ticker": "KXSYNTH-26JAN01-VOID",
        "contract_family": "binary",
        "collateral_return_type": "",
        "settlement_sources": [
          {
            "name": "Synthetic determination source",
            "url": "https://example.invalid/kxsynth-determination"
          }
        ]
      }
    },
    {
      "identity_id": "idn-ev-d1",
      "market_family": "event",
      "identity_version": 1,
      "venue": "kalshi_demo",
      "currency": "USD",
      "prior_identity_id": null,
      "event": {
        "environment": "demo",
        "api_path_observed_not_selected": "trade-api/v2",
        "series_ticker": "KXSYNTH",
        "event_ticker": "KXSYNTH-26JAN01",
        "market_ticker": "KXSYNTH-26JAN01-D1",
        "contract_family": "binary",
        "collateral_return_type": "",
        "settlement_sources": [
          {
            "name": "Synthetic determination source",
            "url": "https://example.invalid/kxsynth-determination"
          }
        ]
      }
    }
  ]
}
